날짜,기사제목,기사요약,기사내용
2024-05-28,Google’s Chromebook Plus laptops with Gemini make AI more affordable,"Google’s Chromebook Plus laptops now feature Gemini AI tricks for image editing and creation, as well as writing and summarizing tools.","We’ve got more AI computer news, as the flavor of the year is now rippling out to Chromebooks. For everyone who saw Microsoft’s news about AI-packed Windows 11 laptops, Google’s basically shouting back, “in this economy?” Yes, Copilot+ PCs like the new Surface Laptop look neat, but what about the people who can’t spend more than $1,000 on a computer with bleeding-edge tricks, and need wallet-friendly budget laptops?

For those people, 2024 marks a new era for the Chromebook Plus laptops, which now feature a dedicated Gemini AI app that brings the assistant to the dock, as well as other AI features. This year’s crop of Chromebook Plus laptops starts as low as $400 with the Acer Chromebook Plus 514, a 14-inch Intel Core i3-based model that sits at the bottom of a range that tops out at a $699 metallic option. Release dates are varied, but expect these laptops to ship soon.

Arguably the most utilitarian AI feature coming to the Chromebook Plus laptops is Live Caption, which will provide subtitles for other languages during Zoom and Google Meet video calls and could cut down language barriers. That said, how often do you see yourself using such a function? More likely usage could come for when you’re watching something on Netflix, as the streaming service’s own subtitles are often subject to debate.

The nicer AI-driven features in Chromebook Plus laptops are image-based, as the system has a Mad-Libs-style tool for generating desktop wallpaper and virtual backgrounds for video conferencing calls. Under the Wallpaper settings, you’ll see a Create with AI section, which currently presents users with eight themes, from characters (where I made wallpapers with red koalas on a gold background) to glowscapes, where I dropped a glowing walkway on a pond. Some users may find this fill-in-the-blanks interface fun, while I’m sure others will see it as limiting. I’m sure many of you are already happy with the desktop wallpaper options you already have, though.

Then, we’ve got the desktop debut of Google’s Magic Editor for photos, which has been in phones such as the Pixel 8 for a little bit now. When I opened up the Google Photos app on the Acer Chromebook Plus 516 GE I’ve been testing, I found a photo of a delicious-looking breakfast sandwich that barely took up any space at all on its plate. Then, with Magic Editor, I was able to select the sandwich by circling it with the touchpad cursor, and then enlarge it by hitting the Shift and + keys at the same time.

The result is a slightly convincing but comically huge sandwich that made me wish today was a cheat day. Magic Editor is pitched more as a way to “fix” images, for those moments when things aren’t properly lined up or that ex you wish you could forget is in a group photo. I’m not exactly interested in that, as it feels a little too close to the memory rewriting tech from the film “Eternal Sunshine of the Spotless Mind,” but to each their own. Some people might just want to erase strangers in the backgrounds of their photos for an image that’s more pleasing, whereas I just see that as a weird way to obsess over your image composition.

This Chromebook feels like a solid option for affordable cloud gaming, with its 120Hz display and RGB keyboard.

Since the Acer Chromebook Plus 516 GE I have my hands on is meant for gaming — you can tell because of the RGB lighting in its keys — I’m curious to test one feature coming to all Chromebooks: the Game Dashboard. This new menu allows you to show or hide controls for games to make them easier to use on laptops, and easily take a screenshot. Chromebook Plus laptops will also gain a Game Capture feature that records both the game and the gamer playing it.

However, Gemini AI in the Chromebook Plus still has all the rough edges you’ve come to expect from any generative AI output tech. The “Help me read” tool on a Chromebook told a presenter at Google’s event “No, you should not be scared of a solar eclipse,” but when the user asked why, it replied, “Looking directly at the sun can lead to permanent eye damage.” Which, you know, is kinda scary. I hope that users see the big “Experiment” and “Quality may vary when using generative Al” labels.

When a presenter tasked Gemini with creating a blog post about the solar eclipse and a headline to match, the bot regurgitated very basic concepts in a poor manner. One heading read “Why You Shouldn’t Look at the Sun” and was followed by another section titled “Safe Ways to Watch.” All under an emoji-encrusted Gemini-generated headline “The Moon, Sun, and Earth for Kids: An Exciting Adventure in the Solar System.” Almost makes me feel like my job as a writer on the internet is safe for now.

Those who find themselves wanting to push Gemini further will want to try out the Gemini Advanced toolkit in the new Google One AI Premium Plan, which comes free for the first 12 months on a new Chromebook Plus (and costs $20 per month thereafter). You’ll be able to query Gemini about your own documents, use the new Gemini 1.5 Pro model and even perform in-line code execution. This plan also ratchets your storage cap up to 2TB.

Speaking of higher specs, these Chromebooks don’t pack a Neural Processing Unit like those Copilot+ PCs. Historically, Chromebook Plus laptops pack an Intel Core i3 or AMD Ryzen 3 7000 CPU or above; a 1080p or higher webcam; at least 8GB of memory; and a 128GB SSD. Copilot+ PCs pack at least twice the memory and storage, and so far run on more-advanced chips such as the Snapdragon X Elite.

But since the Acer Chromebook Plus 516 GE I’m testing will start at $650 when it goes on sale, it’s a bit above the norm, with an Intel Core 5 CPU, a 256GB SSD and a 16-inch WQXGA (2560 x 1600) display that supports 120Hz refresh rates for smoother scrolling and gaming. Its port selection is pleasingly complete, with dual USB-C, one USB-A, HDMI 2.1 out, a headphone jack and even an Ethernet port for stable web connections. We wish the pricier MacBook Air and XPS 14 could match them. Acer rates this laptop for up to 10 hours of battery life, which is based on a test involving various activities including web browsing and email.

I get the sense that regular folks — the kind that Google is chasing with these prices — might not want to invest in technology that still seems half-baked at best. Still, people might get a kick out of Magic Editor, especially if it’s not on the phone they already own. Right now, the Gemini app and integrations seem like the biggest reason to get a Chromebook Plus, unless you (like me) are a massive tab hoarder and want higher specs, such as more memory, by default.

Anyone looking to dip their toes in the AI wading pool has good reason to be curious about the Chromebook Plus as an entry-level device to this weird world. And I totally understand that my skepticism over generative AI may not be reflective of the wider population. Stay tuned for my review of the Acer Chromebook Plus 516 GE and our full coverage of tech in 2024, because you don’t need to have a large language model of data to know that the deluge of AI-infused electronics isn’t ending anytime soon."
2024-05-25,AI in the news,"CNN’s Kim Brunhuber speaks with Noah Giansiracusa, a professor of mathematics at Bentley University, about recent high profile headlines concerning artificial intelligence, or AI.","CNN's Kim Brunhuber speaks with Noah Giansiracusa, a professor of mathematics at Bentley University, about recent high profile headlines concerning artificial intelligence, or AI."
2024-05-25,Google Search’s AI falsely said Obama is a Muslim. Now it’s turning off some results,"Google promised its new artificial intelligence search tools would “do the work for you” and make finding information online quicker and easier. But just days after the launch, the company is already walking back some factually incorrect results.","Google promised its new artificial intelligence search tools would “do the work for you” and make finding information online quicker and easier. But just days after the launch, the company is already walking back some factually incorrect results.
Google earlier this month introduced an AI-generated search results overview tool, which summarizes search results so that users don’t have to click through multiple links to get quick answers to their questions. But the feature came under fire this week after it provided false or misleading information to some users’ questions.
For example, several users posted on X that Google’s AI summary said that former President Barack Obama is a Muslim, a common misconception. In fact, Obama is a Christian. Another user posted that a Google AI summary said that “none of Africa’s 54 recognized countries start with the letter ‘K’” — clearly forgetting Kenya.
Google confirmed to CNN on Friday that the AI overviews for both queries had been removed for violating the company’s policies.
“The vast majority of AI Overviews provide high quality information, with links to dig deeper on the web,” Google spokesperson Colette Garcia said in a statement, adding that some other viral examples of Google AI flubs appear to have been manipulated images. “We conducted extensive testing before launching this new experience, and as with other features we’ve launched in Search, we appreciate the feedback. We’re taking swift action where appropriate under our content policies.”
The bottom of each Google AI search overview acknowledges that “generative AI is experimental.” And the company says it conducts testing designed to imitate potential bad actors in an effort to prevent false or low-quality results from showing up in AI summaries.
Google’s search overviews are part of the company’s larger push to incorporate its Gemini AI technology across all of its products as it attempts to keep up in the AI arms race with rivals like OpenAI and Meta. But this week’s debacle shows the risk that adding AI – which has a tendency to confidently state false information – could undermine Google’s reputation as the trusted source to search for information online.
Even on less serious searches, Google’s AI overview appears to sometimes provide wrong or confusing information.
In one test, CNN asked Google, “how much sodium is in pickle juice.” The AI overview responded that an 8 fluid ounce-serving of pickle juice contains 342 milligrams of sodium but that a serving less than half the size (3 fluid ounces) contained more than double the sodium (690 milligrams). (Best Maid pickle juice, for sale at Walmart, lists 250 milligrams of sodium in just 1 ounce.)
CNN also searched: “data used for google ai training.” In its response, the AI overview acknowledged that “it’s unclear if Google prevents copyrighted materials from being included” in the online data scraped to train its AI models, referencing a major concern about how AI firms operate.
It’s not the first time Google has had to walk back the capabilities of its AI tools over an embarrassing flub. In February, the company paused the ability of its AI photo generator to create images of people after it was blasted for producing historically inaccurate images that largely showed people of color in place of White people.
Google’s Search Labs webpage lets users in areas where AI search overviews have rolled out toggle the feature on and off."
2024-05-31,Communicating with loved ones after they're gone,"With the help of AI, one company helps people create digital copies of themselves.","With the help of AI, one company helps people create digital copies of themselves."
2024-05-24,Elon Musk says AI will take all our jobs,"While speaking at a tech conference, Tesla CEO Elon Musk described a future where jobs would be ”optional,” but added that for this scenario to work, there would need to be “universal high income,” CNN’s Clare Duffy breaks it down for us.","While speaking at a tech conference, Tesla CEO Elon Musk described a future where jobs would be ''optional,'' but added that for this scenario to work, there would need to be “universal high income,'' CNN's Clare Duffy breaks it down for us. "
2024-05-24,Bringing Hollywood home,Anyone with the internet can now use the same AI video tools as top film studios.,Anyone with the internet can now use the same AI video tools as top film studios.
2024-05-24,Creating videos without a camera,AI text-to-video generators are revolutionizing the filmmaking process.,AI text-to-video generators are revolutionizing the filmmaking process.
2024-05-24,Big Tech execs say Europe’s new AI law could harm innovation,Amazon and Meta executives told CNN this week that some of the fears about artificial intelligence are overblown and that the European Union’s sweeping new AI rules risk holding back innovation.,"Amazon and Meta executives told CNN this week that some of the fears about artificial intelligence are overblown and that the European Union’s sweeping new AI rules risk holding back innovation.
The EU gave the final green light to its AI act Tuesday, the same week tech leaders gathered in Paris for the annual VivaTech conference.
The first-of-its-kind law is poised to reshape how firms and other organizations in Europe use AI for everything from health care decisions to policing. It imposes blanket bans on using the technology in ways deemed “unacceptable” — for example, for social scoring.
The regulation also creates new disclosure obligations for large AI companies and requires more transparency on uses of AI considered “high-risk,” such as for education and hiring.
For Meta’s (META) AI chief, Yann LeCun, “the big question” about the new law is “should research and development in AI be regulated?”
“There are clauses in the EU AI act and various other places that do regulate research and development. I don’t think it’s a good idea,” he told CNN’s Anna Stewart at the Paris event.
LeCun, widely known as one of the “godfathers of AI,” disagrees with concerns that AI could soon surpass human intelligence.
“I don’t believe it’s anywhere close,” he said. “I don’t think it’s that dangerous, frankly, certainly not today.”
AI systems might become a lot smarter in the future but then they will be designed with appropriate safeguards, he added.
“But today, trying to figure out how to make future super-intelligent AI systems safe is like asking in 1925 ‘how do we make jet transport safe?’ And jet transport was not invented yet,” he said.
Amazon’s (AMZN) chief technology officer Werner Vogels echoed concerns that AI regulation could stifle innovation in some areas.
When thinking about risks, regulators should consider the application of the new technology to, for instance, health care and financial services differently from its use to summarize meetings, he told Stewart.
“There’s a whole range of areas where I think the risks are minimal and we should let innovation run there,” he said. In other areas, where mistakes can have a bigger impact on people’s lives, risks should be managed “uniquely for that particular area.”
Vogels stressed that Amazon welcomes regulation, and is aligned with regulators in their overall goals, but warned the EU against overregulating AI, pointing to the example of its signature data privacy law, known as GDPR, which he described as a very “thick” book.
“Let’s make sure that the regulatory requirements that we put in place, companies — not just the largest company but every company in Europe — can actually implement,” he said.
“We need to make sure that innovation continues to happen and that the innovation doesn’t just come outside Europe. We already have a very long history in Europe of underinvesting in R&D,” he added."
2024-05-24,‘We’re in the Twilight Zone.’ Actors show CNN why they believe AI company ‘stole’ their voices,"Voice actors Linnea Sage and Paul Skye Lehrman say they recorded their voices for a client who hired them for “academic research” and “tests for radio ads.” Years later, the couple were shocked to discover “AI versions” of their voices. In a video ...","Voice actors Linnea Sage and Paul Skye Lehrman say they recorded their voices for a client who hired them for “academic research” and “tests for radio ads.” Years later, the couple were shocked to discover “AI versions” of their voices. In a video demonstration, they showed CNN’s Clare Duffy why they believe their voices were “stolen.”"
2024-05-24,Meta's Chief AI Scientist says fears around AI safety are overblown,Yann LeCun tells CNN’s Anna Stewart that AI is years away from reaching human-level capabilities.,Yann LeCun tells CNN's Anna Stewart that AI is years away from reaching human-level capabilities.
2024-05-24,Elon Musk says AI will take all our jobs,Elon Musk says artificial intelligence will take all our jobs and that’s not necessarily a bad thing.,"Elon Musk says artificial intelligence will take all our jobs and that’s not necessarily a bad thing.
“Probably none of us will have a job,” Musk said about AI at a tech conference on Thursday.
While speaking remotely via webcam at VivaTech 2024 in Paris, Musk described a future where jobs would be “optional.”
“If you want to do a job that’s kinda like a hobby, you can do a job,” Musk said. “But otherwise, AI and the robots will provide any goods and services that you want.”
For this scenario to work, he said, there would need to be “universal high income” – not to be confused with universal basic income, although he did not share what that could look like. (UBI refers to the government giving a certain amount of money to everyone regardless of how much they earn.)
“There would be no shortage of goods or services,” he said.
AI capabilities have surged over the past few years, fast enough that regulators, companies and consumers are still figuring out how to use the technology responsibly. Concerns also continue to mount over how various industries and jobs will change as AI proliferates in the market.
In January, researchers at MIT’s Computer Science and Artificial Intelligence Lab found workplaces are adopting AI much more slowly than some had expected and feared. The report also said the majority of jobs previously identified as vulnerable to AI were not economically beneficial for employers to automate at that time.
Experts also largely believe that many jobs that require a high emotional intelligence and human interaction will not need replacing, such as mental health professionals, creatives and teachers.
Musk has been outspoken about his concerns around AI. During the keynote on Thursday, he called the technology his biggest fear. He cited the “Culture Book Series” by Ian Banks, a utopian fictionalized look at a society run by advanced technology, as the most realistic and “the best envisioning of a future AI.”
In a job-free future, though, Musk questioned whether people would feel emotionally fulfilled.
“The question will really be one of meaning  – if the computer and robots can do everything better than you, does your life have meaning?” he said.  “I do think there’s perhaps still a role for humans in this – in that we may give AI meaning.”
He also used his stage time to urge parents to limit the amount of social media that children can see because “they’re being programmed by a dopamine-maximizing AI.”"
2024-05-24,Meta created an AI advisory council that’s composed entirely of White men,Meta this week appointed a group of outside advisors to provide guidance on its artificial intelligence strategy. The four-person advisory group is composed entirely of White men.,"Meta this week appointed a group of outside advisors to provide guidance on its artificial intelligence strategy. The four-person advisory group is composed entirely of White men.
The tech giant said the group, which includes tech entrepreneurs and investors, will periodically consult with Meta’s management “on strategic opportunities related to our technology and product roadmap.” The move comes as Meta plans to invest tens of billions of dollars this year in AI infrastructure, research and product development.
The council includes Patrick Collison, the co-founder and chief executive of financial technology company Stripe; Nat Friedman, the tech investor and former CEO of GitHub; Tobi Lütke, the founder and CEO of online shopping firm Shopify; and Charlie Songhurst, the tech investor who formerly led corporate strategy and drove several key acquisitions at Microsoft. A Meta spokesperson confirmed the group will not be paid.
Despite the group’s significant combined experience, Meta is already taking heat for failing to include women or people of color — or anyone else outside of the wealthy, White, male, Silicon Valley mold — in a group advising one of the world’s most powerful tech companies on a revolutionary new technology. The members of the group are also all in their 30s or 40s.
The situation mirrors an incident last year at OpenAI when, in the wake of a leadership shakeup, it came under fire for appointing a board composed entirely of White men. Months later, OpenAI added three women directors to the board.
Artificial intelligence is poised to disrupt nearly every area of life in coming years, from how we get hired and work to how we consume entertainment or search for information.
The large language models that underpin AI systems are trained on vast troves of data, often written by humans and coming from the internet. Experts say that can create the risk of further spreading all-too-human biases already entrenched in internet discourse, but at a frighteningly larger scale.
And historically, women and people of color have borne the brunt of harms from tech advancements — making their inclusion in decision-making processes all the more important. Already, women are increasingly becoming the targets of nonconsensual pornography enabled by AI. Meta’s AI-generated photo tool also faced backlash last month for its apparent struggles to create images of couples or friends from different racial backgrounds.
Research released last year also suggested that Meta’s Facebook algorithm targets users with job postings based on gender stereotypes, although the company does not allow advertisers themselves to target ads based on gender.
“When AI systems are used as the gatekeeper of opportunities, it is critical that the oversight of the design, development, and deployment of these systems reflect the communities that will be impacted by them,” Joy Buolamwini, the founder of the Algorithmic Justice League, an organization tracking the harms of artificial intelligence, told CNN earlier this year.
Meta did not immediately respond to a request for comment on the council’s lack of diversity."
2024-05-24,New concerns over AI's impact on U.S. job market,"CNN’s Rahel Solomon speaks with Brian Merchant, author of this year’s “Blood in the Machine: The Origins of the Rebellion Against Big Tech,” about the future of AI in the job market.","CNN's Rahel Solomon speaks with Brian Merchant, author of this year’s ""Blood in the Machine: The Origins of the Rebellion Against Big Tech,"" about the future of AI in the job market. "
2024-05-23,Growing concern worldwide about AI's impact on elections,"CNN’s Paula Newton talks to Oren Etzioni, the founder of TrueMedia.Org, a non-profit fighting political deepfakes, about concerns that artificial intelligence tools could play an increasingly influential role in elections around the world.","CNN's Paula Newton talks to Oren Etzioni, the founder of TrueMedia.Org, a non-profit fighting political deepfakes, about concerns that artificial intelligence tools could play an increasingly influential role in elections around the world. "
2024-05-23,Worries about possible dangers of artificial intelligence,Charlie Warzel speaks with CNN’s Jake Tapper,Charlie Warzel speaks with CNN's Jake Tapper
