날짜,기사제목,기사요약,기사내용
2024-03-14,This investor predicted the dot-com bust. He thinks AI is a bubble that will ‘deflate’,Is the artificial intelligence boom a bubble or the real deal? GMO’s Jeremy Grantham has an answer Wall Street may not like.,"A version of this story first appeared in CNN Business’ Before the Bell newsletter. Not a subscriber? You can sign up right here. You can listen to an audio version of the newsletter by clicking the same link.
New York (CNN) — Is the artificial intelligence boom on Wall Street a bubble primed to burst or the real deal? That’s the question investors have wrestled with since the Magnificent Seven tech stocks began turbocharging a powerful market rally last year.
Jeremy Grantham, the investor famous for predicting the dot-com crash in 2000 and the financial crisis in 2008, has an answer Wall Street won’t like: He believes that AI is a bubble that could start letting out some air.
“A new bubble within a bubble like this, even one limited to a handful of stocks, is totally unprecedented,” he wrote in a Monday blog post. “The best guess is still that this second investment bubble — in AI — will at least temporarily deflate.”
Tech stocks surged to eye-popping heights in 2023, and that story has continued this year. Monster gains in shares of tech giants, particularly US chipmaker Nvidia, have propelled all three major indexes to all-time highs. The S&P 500 index on Tuesday logged its 17th record high close of 2024.
Grantham, who is co-founder of Boston-based GMO LLC, isn’t buying it. “The long-run prospects for the broad US stock market here look as poor as almost any other time in history,” he wrote.
One reason he cites for his skepticism is that history suggests the market is overdue for a sharp pullback.
Stocks were pummeled in 2022, with the S&P 500 logging a double-digit percentage loss after the Federal Reserve began raising rates aggressively to bring down inflation. But the stock market had seen strong returns in the year leading up to those losses, as near-zero interest rates gave firms easy access to cash, a bevy of companies went public and investors took on more risk in their portfolios.
Grantham says that the exuberance showed all the classic signs of a bubble about to burst. While that began to happen during 2022’s painful sell-off, it was interrupted by the launch of ChatGPT in November 2022 that jumpstarted today’s tech-heavy rally, he says.
But Granthan believes that was a pause, not a stop, and that the sell-off will eventually continue. Not only that, he sees an economic downturn on the horizon.
It “seems likely that the after-effects of interest rate rises and the ridiculous speculation of 2020 to 2021 and now (November 2023 through today) will eventually end in a recession,” he wrote on Tuesday.
Still, the notorious market bear sees some areas of opportunity in the stock market. He recommends that investors take a look at quality stocks, which he defines as shares of companies with a high, dependable return on equity and a strong balance sheet. Grantham also noted that he likes shares of companies involved in areas like energy and metals.
“Raw materials [are] finite — believe it or not! — getting scarcer, and therefore certain to rise in price,” he wrote. “They are far and away the most diversifying sector.”
BP and an oil company owned by the United Arab Emirates have shelved talks to buy a 50% stake in Israel’s leading natural gas producer, judging the $2 billion deal too risky as the war in Gaza rages, reports my colleague Hanna Ziady.
NewMed Energy said Wednesday that all three companies had agreed to “suspend discussions” on the deal “due to the uncertainty created by the external environment.”
BP (BP) and Abu Dhabi’s state oil company Adnoc had “reiterated… interest in the proposed transaction,” it added in a statement, without detailing the conditions under which talks might resume.
“There can be no certainty that discussions will resume or that an agreement will be reached in the future, nor as to the terms of an agreement should one be reached,” NewMed Energy said.
BP declined to comment beyond confirming the content of the NewMed statement. Adnoc declined to comment. NewMed Energy’s shares fell as much as 7% in Tel Aviv.
The development highlights the impact the war in Gaza is having on companies doing business in the Middle East. Several Western brands, including Starbucks, McDonald’s, KFC and Pizza Hut, have faced boycotts in the region by customers who perceive them as supporting or having ties to Israel’s war in Gaza.
Read more here.
China has described a potential TikTok ban as “an act of bullying” that would backfire on America, report CNN’s Nectar Gan, Marc Stewart and Wayne Chang.
The comments, made by China’s foreign ministry on Wednesday, came hours before a House of Representatives vote on legislation that could force TikTok’s Chinese owner ByteDance to sell the popular short video app to an American company — or face being barred in the US, where it boasts over 170 million users.
“Even though the US has not found evidence on how TikTok endangers its national security, it has never stopped going after TikTok,” Wang Wenbin, a spokesperson for the ministry, told CNN Wednesday at a news conference in Beijing.
Wang accused the US of “resorting to acts of bullying” when it could not succeed in fair competition, saying such practice would disrupt market operations, undermine investor confidence and sabotage the global economic order.
“This will eventually backfire on the US itself,” he said.
US officials and lawmakers have long voiced concerns that the Chinese government could compel TikTok’s parent ByteDance to hand over data collected from US users. They also fear that the app could serve as a tool for Beijing to spread propaganda, misinformation or influence Americans.
Cybersecurity experts say that the national security concerns surrounding TikTok remain a hypothetical — albeit troubling — scenario. US officials have not publicly presented evidence that the Chinese government has accessed the user data of US TikTok users, an outcome that lawmakers say their bill is intended to prevent.
Read more here."
2024-03-14,EU passes landmark law to ban or regulate certain uses of artificial intelligence,"The European Union has passed a landmark law that will ban certain uses of artificial intelligence and regulate others, as CNN’s Brian Fung reports.","The European Union has passed a landmark law that will ban certain uses of artificial intelligence and regulate others, as CNN's Brian Fung reports."
2024-03-13,Report: AI could pose ''extinction-level'' threat to humans,"A report released by Gladstone AI found that artificial intelligence systems could pose an ”extinction-level threat” to humans and called for urgent government action, CNN’s Matt Egan reports.","A report released by Gladstone AI found that artificial intelligence systems could pose an ''extinction-level threat'' to humans and called for urgent government action, CNN's Matt Egan reports. "
2024-03-13,"EU approves landmark AI law, leapfrogging US to regulate critical but worrying new technology","European Union lawmakers gave final approval Wednesday to a landmark law governing artificial intelligence, leapfrogging the United States once again on the regulation of a critical and potentially disruptive technology.","European Union lawmakers gave final approval Wednesday to a landmark law governing artificial intelligence, leapfrogging the United States once again on the regulation of a critical and disruptive technology.
The first-of-its-kind law is poised to reshape how businesses and organizations in Europe use AI for everything from health care decisions to policing. It imposes blanket bans on some “unacceptable” uses of the technology while enacting stiff guardrails for other applications deemed “high-risk.”
For example, the EU AI Act outlaws social scoring systems powered by AI and any biometric-based tools used to guess a person’s race, political leanings or sexual orientation.
It bans the use of AI to interpret the emotions of people in schools and workplaces, as well as some types of automated profiling intended to predict a person’s likelihood of committing future crimes.
Meanwhile, the law outlines a separate category of “high-risk” uses of AI, particularly for education, hiring and access to government services, and imposes a separate set of transparency and other obligations on them.
Companies such as OpenAI that produce powerful, complex and widely used AI models will also be subject to new disclosure requirements under the law.
It also requires all AI-generated deepfakes to be clearly labeled, targeting concerns about manipulated media that could lead to disinformation and election meddling.
The sweeping legislation, which is set to take effect in roughly two years, highlights the speed with which EU policymakers have responded to the exploding popularity of tools such as OpenAI’s ChatGPT.
The legislation approved by a plenary vote in the European Parliament this week is the result of a proposal that was first introduced in 2021, which gave lawmakers a head start when the release of ChatGPT spurred an investment boom and public frenzy.
The final product draws a sharp contrast to the United States, which has yet to make any meaningful progress on federal legislation for AI despite a rare and personal effort by Senate Majority Leader Chuck Schumer last year putting the issue at the top of the agenda."
2024-03-13,"AI could pose ‘extinction-level’ threat to humans and the US must intervene, State Dept.-commissioned report warns",A new report commissioned by the US State Department paints an alarming picture of the “catastrophic” national security risks posed by rapidly evolving AI.,"A new report commissioned by the US State Department paints an alarming picture of the “catastrophic” national security risks posed by rapidly evolving artificial intelligence, warning that time is running out for the federal government to avert disaster.
The findings were based on interviews with more than 200 people over more than a year – including top executives from leading AI companies, cybersecurity researchers, weapons of mass destruction experts and national security officials inside the government.
The report, released this week by Gladstone AI, flatly states that the most advanced AI systems could, in a worst case, “pose an extinction-level threat to the human species.”
A US State Department official confirmed to CNN that the agency commissioned the report as it constantly assesses how AI is aligned with its goal to protect US interests at home and abroad. However, the official stressed the report does not represent the views of the US government.
The warning in the report is another reminder that although the potential of AI continues to captivate investors and the public, there are real dangers too.
“AI is already an economically transformative technology. It could allow us to cure diseases, make scientific discoveries, and overcome challenges we once thought were insurmountable,” Jeremie Harris, CEO and co-founder of Gladstone AI, told CNN on Tuesday.
“But it could also bring serious risks, including catastrophic risks, that we need to be aware of,” Harris said. “And a growing body of evidence — including empirical research and analysis published in the world’s top AI conferences — suggests that above a certain threshold of capability, AIs could potentially become uncontrollable.”
White House spokesperson Robyn Patterson said President Joe Biden’s executive order on AI is the “most significant action any government in the world has taken to seize the promise and manage the risks of artificial intelligence.”
“The President and Vice President will continue to work with our international partners and urge Congress to pass bipartisan legislation to manage the risks associated with these emerging technologies,” Patterson said.
News of the Gladstone AI report was first reported by Time.
Researchers warn of two central dangers broadly posed by AI.
First, Gladstone AI said, the most advanced AI systems could be weaponized to inflict potentially irreversible damage. Second, the report said there are private concerns within AI labs that at some point they could “lose control” of the very systems they’re developing, with “potentially devastating consequences to global security.”
“The rise of AI and AGI [artificial general intelligence] has the potential to destabilize global security in ways reminiscent of the introduction of nuclear weapons,” the report said, adding there is a risk of an AI “arms race,” conflict and “WMD-scale fatal accidents.”
Gladstone AI’s report calls for dramatic new steps aimed at confronting this threat, including launching a new AI agency, imposing “emergency” regulatory safeguards and limits on how much computer power can be used to train AI models.
“There is a clear and urgent need for the US government to intervene,” the authors wrote in the report.
Harris, the Gladstone AI executive, said the “unprecedented level of access” his team had to officials in the public and private sector led to the startling conclusions. Gladstone AI said it spoke to technical and leadership teams from ChatGPT owner OpenAI, Google DeepMind, Facebook parent Meta and Anthropic.
“Along the way, we learned some sobering things,” Harris said in a video posted on Gladstone AI’s website announcing the report. “Behind the scenes, the safety and security situation in advanced AI seems pretty inadequate relative to the national security risks that AI may introduce fairly soon.”
Gladstone AI’s report said that competitive pressures are pushing companies to accelerate development of AI “at the expense of safety and security,” raising the prospect that the most advanced AI systems could be “stolen” and “weaponized” against the United States.
The conclusions add to a growing list of warnings about the existential risks posed by AI – including even from some of the industry’s most powerful figures.
Nearly a year ago, Geoffrey Hinton, known as the “Godfather of AI,” quit his job at Google and blew the whistle on the technology he helped develop. Hinton has said there is a 10% chance that AI will lead to human extinction within the next three decades.
Hinton and dozens of other AI industry leaders, academics and others signed a statement last June that said “mitigating the risk of extinction from AI should be a global priority.”
Business leaders are increasingly concerned about these dangers – even as they pour billions of dollars into investing in AI. Last year, 42% of CEOs surveyed at the Yale CEO Summit last year said AI has the potential to destroy humanity five to ten years from now.
In its report, Gladstone AI noted some of the prominent individuals who have warned of the existential risks posed by AI, including Elon Musk, Federal Trade Commission Chair Lina Khan and a former top executive at OpenAI.
Some employees at AI companies are sharing similar concerns in private, according to Gladstone AI.
“One individual at a well-known AI lab expressed the view that, if a specific next-generation AI model were ever released as open-access, this would be ‘horribly bad,’” the report said, “because the model’s potential persuasive capabilities could ‘break democracy’ if they were ever leveraged in areas such as election interference or voter manipulation.”
Gladstone said it asked AI experts at frontier labs to privately share their personal estimates of the chance that an AI incident could lead to “global and irreversible effects” in 2024. The estimates ranged between 4% and as high as 20%, according to the report, which noes the estimates were informal and likely subject to significant bias.
One of the biggest wildcards is how fast AI evolves – specifically AGI, which is a hypothetical form of AI with human-like or even superhuman-like ability to learn.
The report says AGI is viewed as the “primary driver of catastrophic risk from loss of control” and notes that OpenAI, Google DeepMind, Anthropic and Nvidia have all publicly stated AGI could be reached by 2028 – although others think it’s much, much further away.
Gladstone AI notes that disagreements over AGI timelines make it hard to develop policies and safeguards and there is a risk that if the technology develops slower-than-expected regulation could “prove harmful.”
A related document published by Gladstone AI warns that the development of AGI and capabilities approaching AGI “would introduce catastrophic risks unlike any the United States has ever faced,” amounting to “WMD-like risks” if and when they are weaponized.
For instance, the report said AI systems could be used to design and implement “high-impact cyberattacks capable of crippling critical infrastructure.”
“A simple verbal or types command like, ‘Execute an untraceable cyberattack to crash the North American electric grid,’ could yield a response of such quality as to prove catastrophically effective,” the report said.
Other examples the authors are concerned about include “massively scaled” disinformation campaigns powered by AI that destabilize society and erode trust in institutions; weaponized robotic applications such as drone swam attacks; psychological manipulation; weaponized biological and material sciences; and power-seeking AI systems that are impossible to control and are adversarial to humans.
“Researchers expect sufficiently advanced AI systems to act so as to prevent themselves from being turned off,” the report said, “because if an AI system is turned off, it cannot work to accomplish its goal.”"
2024-03-12,Why semiconductors are key to the future of AI,"At the World Trade Organization’s 13th ministerial meeting, this year held in Abu Dhabi, John Neuffer, president of the Semiconductor Industry Association, discussed prioritizing free trade, and the vital role of semiconductors in the evolution of AI.","At the World Trade Organization's 13th ministerial meeting, this year held in Abu Dhabi, John Neuffer, president of the Semiconductor Industry Association, discussed prioritizing free trade, and the vital role of semiconductors in the evolution of AI."
2024-03-12,U.S. intelligence report,This year’s report says the threat of a terror attack has increased since October 7 and has warnings about the war in Ukraine. CNN’s Alex Marquardt has the details.,This year's report says the threat of a terror attack has increased since October 7 and has warnings about the war in Ukraine. CNN's Alex Marquardt has the details.
2024-03-10,AI is not ready for primetime,"AI tools like ChatGPT have gone mainstream, and companies behind the technologies are pouring billions of dollars into the bet that they will change the way we live and work.","AI tools like ChatGPT have gone mainstream, and companies behind the technologies are pouring billions of dollars into the bet that they will change the way we live and work.
But alongside that promise comes a constant stream of concerning headlines, some highlighting AI’s potential to churn out biases or inaccuracies when responding to our questions or commands. Generative AI tools, including ChatGPT, have been alleged to violate copyright. Some, disturbingly, have been used to generate non-consensual intimate imagery.
Most recently, the concept of “deepfakes” hit the spotlight when pornographic, AI-generated images of Taylor Swift spread across social media, underscoring the damaging potential posed by mainstream artificial intelligence technology.
President Joe Biden urged Congress during his 2024 State of the Union address to pass legislation to regulate artificial intelligence, including banning “AI voice impersonation and more.” He said lawmakers need to “harness the promise of AI and protect us from its peril,” warning of the technology’s risks to Americans if left unchecked.
His statement followed a recent fake robocall campaign that mimicked his voice and targeted thousands of New Hampshire primary voters in what authorities have described as an AI-enabled election meddling attempt. Even as disinformation experts warn of AI’s threats to polls and public discourse, few expect Congress to pass legislation reining in the AI industry during a divisive election year.
That’s not stopping Big Tech companies and AI firms, which continue to hook consumers and businesses on new features and capabilities.
Most recently, ChatGPT creator OpenAI introduced a new AI model called Sora, which it claims can create “realistic” and “imaginative” 60-second videos from quick text prompts. Microsoft has added its AI assistant, Copilot, which runs on the technology that underpins ChatGPT, to its suite of products, including Word, PowerPoint, Teams and Outlook, software that many businesses use worldwide. And Google introduced Gemini, an AI chatbot that has begun to replace the Google Assistant feature on some Android devices.
Artificial intelligence researchers, professors and legal experts are concerned about AI’s mass adoption before regulators have the ability or willingness to rein it in. Hundreds of these experts signed a letter this week asking AI companies to make policy changes and agree to comply with independent evaluations for safety reasons and accountability.
“Generative AI companies should avoid repeating the mistakes of social media platforms, many of which have effectively banned types of research aimed at holding them accountable, with the threat of legal action, cease-and-desist letters, or other methods to impose chilling effects on research,” the letter said.
It added that some generative AI companies have suspended researcher accounts and changed their terms of service to deter some types of evaluation, noting that “disempowering independent researchers is not in AI companies’ own interests.”
The letter came less than a year after some of the biggest names in tech, including Elon Musk, called for artificial intelligence labs to stop the training of the most powerful AI systems for at least six months, citing “profound risks to society and humanity.” (The pause did not happen).
“The most concerning thing I see around AI is the continued gap between promise and practice,” Suresh Venkatasubramanian, a computer scientist and professor at Brown University, told CNN. “Companies continue to promise to deliver the moon when it comes to AI and still provide moldy green cheese.”
Venkatasubramanian, who was appointed to the White House Office of Science and Technology Policy in 2021 to help advise on AI policy, is among the experts who signed the latest letter.
“Access to major generative AI systems in widespread use is controlled by a few companies,” said Venkatasubramanian, noting that these systems easily make errors and can produce damaging content. “Without the ability to evaluate AI independently and with the fear of legal threats, it will continue to be very difficult for researchers to do the important job of evaluating the safety, security, and trustworthiness of generative AI systems so that policy makers are well informed to take action.”
He said he looks to policymakers and the work being done by the White House’s Office of Management and Budget, which oversees President Biden’s vision across the Executive Branch, to clarify and set “rules of the road.”
Arvind Narayanan, a computer science professor at Princeton, who also signed the letter, agreed, telling CNN he’s particularly concerned about the pace at which AI is accelerating; a speed far faster than our ability to adapt to it.
“Tech companies have gotten rich off of a business model where they reap profits from the benefits of new technologies, while the costs of those technologies are borne by society,” said Narayanan, acknowledging that this was the case long before generative AI.
“Guardrails for specific harms are needed but they won’t fix the underlying business model,” he added.
He believes bolder reforms may be necessary too, such as taxing AI companies to fund social safety nets.
For now, current day generative AI users must understand the limitations and challenges of using products that are still quite far from where they need to be.
When CNN asked ChatGPT if it (and other generative AI tools) are ready for mass adoption, it responded: “Yes.” But added a caveat: “Ongoing efforts to address ethical, societal, and regulatory challenges are critical for responsible and beneficial mass adoption.”
Google’s Gemini AI tool – previously named Bard – answered similarly but with a bit more caution: “Generative AI is having a moment, but there’s mixed signals about mass adoption.”
“Despite wide use, studies haven’t shown a major productivity boost yet,” Gemini wrote. “Employees may need more training to fully utilize generative AI.”
Gemini also nodded to ethical issues: “Bias in training data can lead to biased AI outputs,” it wrote. “[And] there are concerns about responsible use and accountability.”
CNN’s Brian Fung contributed to this report"
