날짜,기사제목,기사요약,기사내용
2024-08-27,Apple is expected to debut the first generative AI iPhone at its September 9 event,"Apple has announced the date of its next major event, where the iPhone 16 is expected to launch.","Apple has announced the date of its next major event, where the iPhone 16 is expected to launch.
On Monday, September 9 the tech giant is hosting a special event with the tag line “It’s Glowtime.” The event will take place at 10 am PT at the Steve Jobs Theater in Apple Park andwill be streamed online.
Though it’s not quite clear yet what “glowtime” is referring to, embedded artificial intelligence is expected to be a key feature of the latest iPhone.
In June, Apple announced a slew of generative AI features for the iPhone its annual Worldwide Developers Conference. The company unveiled the first batch of tools powered by “Apple Intelligence,” from personalized Genmoji — Apple’s AI-generated emoji — to a significantly smarter Siri, which can answer questions about your schedule, what’s in your email and what time your loved one’s flight is landing.
Though iPhone 15 Pro Max users will likely be able to access at least some of the AI features, the upcoming iPhone 16 is expected to be the first device designed fully with AI in mind.
At the conference, Apple also announced a partnership with ChatGPT creator OpenAI, which is facing its own scrutiny and challenges.
Artificial intelligence has been integrated in some iPhone features for years now, such as Live Text and an improved autocorrect function over the original. But enhanced generative AI could build on those features aimed at enhancing interaction and personalization, potentially making a new iPhone the first specifically built with some of those features in mind.
But Angelo Zino, a CFRA Research technology analyst, said the outlook for the iPhone 16 is muted, since the new AI features will be rolled out over the next few years — enhanced Siri may even come as late as 2025, for example, Zino said.
“This is going to be more of an evolutionary process, rather than some big cyclical, iPhone cycle,” Zino said.
Generative AI enables tools to create written work, images and even audio in response to prompts from users.
Apple’s segueway into artificial intelligence would most likely be through Siri, the company’s virtual assistant, analysts said. Combining Siri with OpenAI’s latest ChatGPT-4o model could allow the assistant to recall a picture taken years ago, provide more specific information, and even possibly learn the user’s preferences and personality over time.
The launch could change Apple’s trajectory for the iPhone. iPhone sales in China have tumbled due to uncertain economic conditions and growing competition.
One of the biggest questions about the device launch is how much it will cost. Apple enthusiasts have debated for years whether iPhone models should be cheaper, while investors would prefer maximum profit. CFRA isn’t modeling a huge price spike for the iPhone 16, but the inclusion of AI capabilities “could potentially see them increase prices across the board” Zino said.
Apple’s competitors have already dipped into the generative AI space, such as Samsung’s “circle to search” feature, which allows users to quickly search for information on a device’s screen with a finger gesture."
2024-08-25,Will.i.am demonstrates how to use his AI app 'RAiDiO.FYI',CNN’s Fredricka Whitfield speaks with Grammy winner Will.i.am about his new app “RAiDiO.FYI” which uses AI technology.,"CNN's Fredricka Whitfield speaks with Grammy winner Will.i.am about his new app ""RAiDiO.FYI"" which uses AI technology."
2024-08-25,Taylor Swift fake posted by Trump highlights challenges in AI misuse regulation,"When former President Donald Trump reposted a fake image of Taylor Swift striking a pose like the iconic Uncle Sam recruiting poster, it pushed to the forefront a topic that goes beyond politics: unauthorized digital replicas.","When former President Donald Trump reposted a fake image of Taylor Swift striking a pose like the iconic Uncle Sam recruiting poster, it pushed to the forefront a topic that goes beyond politics: unauthorized digital replicas.
Concerned by the proliferation of AI tools, state and federal legislators have recently launched or pushed for efforts to protect anyone against the misuse of their name, voice, image and likeness in the digital era. For experts, Trump’s social media post highlights why those broad legislative efforts are taking place, in addition to being one of the most visible bogus claims in the 2024 campaign.
Trump reposted last weekend on his Truth Social platform several images including the one depicting Taylor Swift as Uncle Sam. The image included the text, “Taylor wants you to vote for Donald Trump.” In response to the fake endorsement, Trump posted a carousel of (Swift) images, along with the comment, “I accept!”
A representative for Swift did not immediately respond to CNN’s request for comment. The pop icon has not made an endorsement in this presidential race.
In an interview with Fox Business on Wednesday, Trump denied creating the images when asked if he was worried about a potential lawsuit.
“I don’t know anything about them, other than somebody else generated them, I didn’t generate them,” Trump said. “These were all made up by other people. AI is always very dangerous in that way.”
Tennessee is among the latest states to enact a law aimed at protecting people from unauthorized use of content that mimics their image or voice.
The Ensuring Likeness Voice and Image Security Act or ELVIS Act, which went into effect last month, expands the state’s existing right-of-publicity law to specifically protect artists, including a person’s voice, and make unlawful the use of content “in any medium.”
The law could be a vehicle for Swift – who started her career in Nashville where she is part-time resident – to sue.
Tennessee Senate Majority Leader Jack Johnson, a Republican who sponsored the bill, has said the misuse of AI-generated content and the impact it has on artists were part of the reasons why the law was updated.
“The rapid advancement of AI is exciting in many ways, but it also presents new challenges – especially for singers, songwriters, and other music professionals,” Johnson said in a news release when Tennessee Gov. Bill Lee signed the ELVIS Act into law. CNN has reached out to the governor’s office for comment.
Joseph Fishman, a law professor at Vanderbilt University whose research has centered on intellectual property and entertainment law, said one of the issues with the law is that it’s so broad that “it covers just about any unauthorized use of a person’s likeness or voice that the distributor of the image or video or sound knows wasn’t authorized.”
Since 2019, several states have passed legislation related to the use of fake content. In the 2024 session, at least 40 states have pending legislation, according to the National Conference of State Legislatures. While the laws do not exclusively apply to content created by AI, many laws are intended to target sexually explicit content and some focus on content meant to deceive voters, the group said.
When it comes to political campaigns, more than a dozen states have enacted legislation to regulate the use of so-called deepfakes – realistic fake video, audio and other content created with AI. Depending on the state, violators could face prison time and hefty fines; candidates could be required to forfeit their office or nomination, CNN previously reported.
While there appears to be a wave of new AI-centered legislation, the unauthorized use of digital replicas could be punishable under other existing laws, said Corynne McSherry, legal director at the nonprofit Electronic Frontier Foundation, who specializes in intellectual property, open access and free speech issues.
“If you’re worried that there’s a use of an image of you, or your face and you think it’s in a way that’s defamatory or implies false endorsement, you probably already got rights under defamation law, potentially even under trademark law, like we have lots of long standing doctrines to address that kind of situation,” McSherry said.
At the federal level, Congress has yet to pass a nationwide framework to regulate AI, including AI-generated replicas. However, the Federal Communications Commission has sought fines after an AI-generated robocall imitating President Joe Biden’s voice urged voters not to participate in New Hampshire’s primary election. The robocalls used call-spoofing technology that violated federal caller-ID laws, the FCC said.
The carrier that transmitted the robocalls, Lingo Telecom, agreed Wednesday to pay a $1 million fine. Steven Kramer, the political consultant behind the call, is facing a $6 million fine.
Last month, the US Copyright Office released a report urging lawmakers to pass a federal law to address unauthorized digital replicas.
“It has become clear that the distribution of unauthorized digital replicas poses a serious threat not only in the entertainment and political arenas but also for private citizens,” Shira Perlmutter, register of copyrights and director of the US Copyright Office, said in a statement. “We believe there is an urgent need for effective nationwide protection against the harms that can be caused to reputations and livelihoods.”
For Darrel Mottley, a patent attorney and faculty director of the intellectual property and entrepreneurship clinic at Suffolk University, it’s important to remember that regulation should focus on how AI is used and not the technology itself.
“We don’t regulate the technology, per se, we want to regulate the human behavior of using the technology in a way that’s not what we think is appropriate. That’s kind of what the regulations should be doing,” Mottley said.
Legal experts agree that Swift could file a lawsuit under the ELVIS Act, thanks to her ties to the Southern state, but the outcome is unclear.
“The ELVIS Act could be among the laws that apply to what Trump did and under which he could be liable,” Fishman said.
In a potential lawsuit against Trump, attorneys for the former President could argue the post was satire or parody, which is protected under the First Amendment, Fishman and McSherry said.
The ELVIS Act has an exemption for uses protected by the First Amendment, including criticism, satire and parody. Fishman noted the boundaries of that exemption were not detailed in the statue “so nobody really knows how courts are going to draw those lines.”
“There’s a lot of murkiness around how this would actually play out if there were a lawsuit but if that exemption doesn’t apply, it certainly seems like posting these images is covered by this Tennessee law,” Fishman said.
The fact that some of the images were generated by AI made the situation “a lot more provocative,” Fishman says, but Trump could face an equal legal risk “if he had photoshopped a photograph (or if) he was a really good drawer and drew something. The problem would still be the same.”
In McSherry’s view, Swift could simply opt to address it outside the court system.
“Given Taylor Swift’s reach as a celebrity, I think she could feel a lot more effective, frankly, if she just used her own platform to repudiate it, and that would accomplish as much as any lawsuit,” McSherry said.
With or without the rise of AI-generated content, legal experts agreed that you don’t have to be a celebrity to hold people accountable if your voice, likeness or image is misused to imply false endorsement."
2024-08-16,"Elon Musk’s AI photo tool is generating realistic, fake images of Trump, Harris and Biden","Elon Musk’s AI chatbot Grok on Tuesday began allowing users to create AI-generated images from text prompts and post them to X. Almost immediately, people began using the tool to flood the social media site with fake images of political figures ...","Elon Musk’s AI chatbot Grok on Tuesday began allowing users to create AI-generated images from text prompts and post them to X. Almost immediately, people began using the tool to flood the social media site with fake images of political figures such as former President Donald Trump and Vice President Kamala Harris, as well as of Musk himself — some depicting the public figures in obviously false but nonetheless disturbing situations, like participating in the 9/11 attacks.
Unlike other mainstream AI photo tools, Grok, created by Musk’s artificial intelligence startup xAI, appears to have few guardrails.
In tests of the tool, for example, CNN was easily able to get Grok to generate fake, photorealistic images of politicians and political candidates that, taken out of context, could be misleading to voters. The tool also created benign yet convincing images of public figures, such as Musk eating steak in a park.
Some X users posted images they said they created with Grok showing prominent figures consuming drugs, cartoon characters committing violent murders and sexualized images of women in bikinis. In one post viewed nearly 400,000 times, a user shared an image created by Grok of Trump leaning out of the top of a truck, firing a rifle. CNN tests confirmed the tool is capable of creating such images.
The tool is likely to add to concerns that artificial intelligence could create an explosion of false or misleading information across the internet, especially ahead of the US presidential election. Lawmakers, civil society groups and even tech leaders themselves have raised alarms that the misuse of such tools could cause confusion and chaos for voters.
“Grok is the most fun AI in the world!” Musk posted on X Wednesday, in response to a user praising the tool for being “uncensored.”
Many other leading AI companies have taken some steps to prevent their AI image generation tools from being used to create political misinformation, although researchers found users can still sometimes find ways around enforcement measures. Some companies, including OpenAI, Meta and Microsoft, also include technology or labels to help viewers identify images that have been made with their AI tools.
Rival social media platforms, including YouTube, TikTok, Instagram and Facebook have also taken steps to label AI-generated content in users’ feeds, either by using technology to detect it themselves or asking users to identify when they’re posting such content.
X did not immediately respond to a request for comment regarding whether it has any policies against Grok generating potentially misleading images of political candidates.
By Friday, xAI appeared to have introduced some restrictions on Grok, in response to critical reports and the disturbing images that users were creating and posting. The tool now refuses to create images of political candidates or widely recognized cartoon characters (whose intellectual property belongs to other companies) committing acts of violence or alongside hate speech symbols, although users noted the restrictions seemed limited to only certain terms and image subjects.
X has a policy against sharing “synthetic, manipulated, or out-of-context media that may deceive or confuse people and lead to harm,” although it’s unclear how the policy is enforced. Musk himself shared a video last month on X that used AI to make it appear that Harris had said things she, in fact, did not — in an apparent violation of the policy and with only a laughing face emoji to suggest to followers that it was fake.
The new Grok image tool also comes as Musk faces criticism for repeatedly spreading false and misleading claims on X related to the presidential election, including a post raising questions about the security of voting machines. It also comes days after Musk hosted Trump for a more than two-hour livestreamed conversation on X in which the Republican hopeful made at least 20 false claims without pushback from Musk.
Other AI image generation tools have faced backlash for various issues. Google paused the ability for its Gemini AI chatbot to generate images of people after it was blasted for producing historically inaccurate depictions of people’s races; Meta’s AI image generator came under fire for struggling to create images of couples or friends from different racial backgrounds. TikTok was also forced to pull an AI video tool after CNN discovered that any user could create realistic-looking videos of people saying anything, including vaccine misinformation, without labels.
Grok does appear to have some restrictions; for example, a prompt requesting a nude image returned a response saying, “unfortunately, I can’t generate that kind of image.”
In a separate test, the tool said it also has “limitations on creating content that promotes or could be seen as endorsing harmful stereotypes, hate speech, or misinformation.”
“It’s important to avoid spreading falsehoods or content that could incite hatred or division. If you have other requests or need information on a different topic, feel free to ask!” Grok said.
However, in response to a different prompt, the tool did generate an image of a political figure standing alongside a hate speech symbol — a sign that whatever restrictions Grok does have, they appear not to be enforced consistently.
–CNN’s Jon Passantino contributed to this report. This story has been updated to reflect changes xAI has made to Grok."
2024-08-15,Clearview AI's founder defends controversial facial recognition app,"Hoan Ton-That’s app, Clearview AI, triggered fears about facial recognition — and the dystopian future it could foreshadow. CNN Business’ Donie O’Sullivan sat down with the CEO to talk about questions of legality, privacy, and bias in the era of facial ...","Hoan Ton-That's app, Clearview AI, triggered fears about facial recognition — and the dystopian future it could foreshadow. CNN's Donie O'Sullivan sat down with the CEO in 2020 to talk about questions of legality, privacy, and bias in the era of facial recognition."
2024-08-10,Brands should avoid this popular term. It’s turning off customers,"From fashion to fast food, it seems that AI is the name of the game. But eEven as tech giants pour billions of dollars into what they herald as humanity’s new frontier, a recent study shows that tacking the “AI” label on products may actually drive ...","Even as tech giants pour billions of dollars into what they herald as humanity’s new frontier, a recent study shows that tacking the “AI” label on products may actually drive people away.
A study published in the Journal of Hospitality Marketing & Management in June found that describing a product as using AI lowers a customer’s intention to buy it. Researchers sampled participants across various age groups and showed them the same products – the only difference between them: one was described as “high tech” and the other as using AI, or artificial intelligence.
“We looked at vacuum cleaners, TVs, consumer services, health services,” said Dogan Gursoy, one of the study’s authors and the Taco Bell Distinguished Professor of hospitality business management at Washington State University, in an interview with CNN. “In every single case, the intention to buy or use the product or service was significantly lower whenever we mentioned AI in the product description.”
Despite AI’s rapid advancement in recent months, the study highlights consumers’ hesitance to incorporate AI into their daily lives – a marked divergence from the enthusiasm driving innovations in big tech.
Included in the study was an examination of how participants viewed products considered “low risk,” which included household appliances that use AI, and “high risk,” which included self-driving cars, AI-powered investment decision-making services and medical diagnosis services.
While the percentage of people rejecting the items was greater in the high-risk group, non-buyers were the majority in both product groups.
There are two kinds of trust that the study says play a part in consumers’ less-than-rosy perception of products that describe themselves as “AI-powered.”
The first kind, cognitive trust, has to do with the higher standard that people hold AI to as a machine they expect to be free from human error. So, when AI does slip up, that trust can be quickly eroded.
Take Google’s AI-generated search results overview tool, which summarizes search results for users and presents them at the top of the page. People were quick to criticize the company earlier this year for providing confusing and even blatantly false information to users’ questions, pressuring Google to walk back some of the features’ capabilities.
Gursoy says that limited knowledge and understanding about the inner workings of AI forces consumers to fall back on emotional trust and make their own subjective judgments about the technology.
“One of the reasons why people are not willing to use AI devices or technologies is fear of the unknown,” he said. “Before ChatGPT was introduced, not many people had any idea about AI, but AI has been running in the background for years and it’s nothing new.”
Even before chatbot ChatGPT burst into public consciousness in 2022, artificial intelligence was used in technology behind familiar digital services, from your phone’s autocorrect to Netflix’s algorithm for recommending movies.
And the way AI is portrayed in pop culture isn’t helping boost trust in the technology either. Gursoy added that Hollywood science fiction films casting robots as villains had a bigger impact on shaping public perception towards AI than one might think.
“Way before people even heard about AI, those movies shaped people’s perception of what robots that run by AI can do to humanity,” he said.
Another part of the equation influencing customers is the perceived risk around AI – particularly with how it handles users’ personal data.
Concerns about how companies manage customers’ data have tamped down excitement around tools meant to streamline the user experience at a time when the government is still trying to find its footing on regulating AI.
“People have worries about privacy. They don’t know what’s going on in the background, the algorithms, how they run, that raises some concern,” said Gursoy.
This lack of transparency is something that Gursoy warns has the potential to sour customers’ perceptions towards brands they may have already come to trust. It is for this reason that he cautions companies against slapping on the “AI” tag as a buzzword without elaborating on its capabilities.
“The most advisable thing for them to do is come up with the right messaging,” he said. “Rather than simply putting ’AI-powered’ or ’run by AI,’ telling people how this can help them will ease the consumer’s fears.”"
2024-08-09,This robot fish could one day change how our oceans are studied,"Eve is an autonomous underwater vehicle that collects valuable data while blending into its marine environment, thanks to its fish-like design. CNN meets the university students from ETH Zurich who developed the technology.","""Eve"" is an autonomous underwater vehicle that collects valuable data while blending into its marine environment, thanks to its fish-like design. CNN meets the ETH Zurich students who developed the tech."
2024-08-03,Google pulls Olympics ad that showed AI writing a little girl’s letter for her,Google has pulled its controversial Olympics ad after critics blasted it for portraying what they called a bleak application of artificial intelligence.,"Google has pulled its controversial Olympics ad after critics blasted it for portraying what they called a bleak application of artificial intelligence.
The ad showed a father using Google’s Gemini AI chatbot to help his daughter write a fan letter to US Olympic track star Sydney McLaughlin-Levrone. But many online questioned why Google would want to replace a child’s creativity with words written by a computer.
Google initially defended the ad, which ran during breaks from the Olympics, saying it showed how Gemini could provide a “starting point” for a piece of writing. But on Friday, the company reversed course.
“While the ad tested well before airing, given the feedback, we have decided to phase the ad out of our Olympics rotation,” a Google spokesperson said in a statement.
The ad marked a striking miss for the tech giant, which has positioned Gemini as its answer to rival OpenAI’s ChatGPT and is working to incorporate the AI technology throughout its suite of products, including Google Search and Gmail.
And it underscored a broader fear around artificial intelligence that the technology could take away jobs from people in creative fields, such as writers, musicians and visual artists.
Apple faced similar backlash earlier this year when it released an ad that showed symbols of human creativity — paint cans, musical instruments, a sculptural bust of a human head — being crushed by a giant hydraulic press and replaced by an iPad Pro, to the tune of Sonny & Cher’s “All I Ever Need Is You.” Apple quickly apologized for “missing the mark” with the advertisement."
