날짜,기사제목,기사요약,기사내용
2024-12-22,‘A sort of superpower’: Unexpected revelations made possible by AI in 2024,"Artificial intelligence came of age in 2024, helping to decode the mysteries of ancient scrolls, whale vocalizations, the building blocks of life, and more.","Charred to a crisp, the hundreds of brittle ancient scrolls would crumble if one were to attempt to unfurl them, and any trace of script would be nearly illegible. The Herculaneum scrolls, as they are known, still remain unopened, but thanks to the powerful tool that is artificial intelligence, their contents now lie within reach.
Using AI and high-resolution X-rays, a trio of researchers decoded in 2023 more than 2,000 characters from the rolled scrolls — the remarkable feat laid bare the first full passages from papyri that had survived the eruption of Mount Vesuvius in AD 79.
The artifacts, recovered from a building believed to have been the house of Julius Caesar’s father-in-law, form an unprecedented cache of information about ancient Rome and Greece.
Computer scientists who launched the Vesuvius Challenge, a competition designed to accelerate the deciphering process, hope that 90% of four scrolls will be unlocked by the end of 2024. The key challenge has been to virtually flatten the documents and distinguish the black ink from the carbonized papyri to make the Greek and Latin script readable.
“The AI is helping us amplify the readability of the evidence of the ink,” said Brent Seales, a professor of computer science at the University of Kentucky who has been working to decode the scrolls for more than a decade. “The evidence for the ink is there. It’s buried and camouflaged in all of this complexity that the AI distills and condenses.”
The project is one compelling example of the growing utility of artificial intelligence, which came of age in 2024 with the Nobel committee recognizing AI’s development and application in science for the first time: The physics prize recognized John Hopfield and Geoffrey Hinton for their fundamental discoveries in machine learning, paving the way for how artificial intelligence is used today.
A fuzzy and often overhyped term, AI aims to mimic human cognitive functions to solve problems and complete tasks. Artificial intelligence encompasses a range of computational techniques: using data sets to train and improve machine learning algorithms and enabling them to spot patterns and inform predictions.
Some AI tools can pose risks, such as systems used in hiring, policing and loan applications that replicate bias, because they may be trained on historical data reflecting prejudiced ideas, for example, on sex or race, that ultimately result in discrimination.
AI has transformed the landscape of scientific discovery, with the number of peer-reviewed papers using AI tools increasing sharply since 2015 and those that use AI methods more likely to be among the most cited. More than half of 1,600 scientists surveyed by Nature expected AI tools to be “very important” or “essential” to the practice of research. However, the UK’s Royal Society, the world’s oldest academy of sciences, has warned that the black-box nature of many AI tools is limiting the reproducibility of AI-based research. For Seales, though, it’s a powerful instrument deployed wisely that has generated dramatic results.
“AI is a field of computer science designed to try to solve problems in ways that we thought only humans could solve problems,” Seales said. “I think of the kind of AI we’re using as a sort of superpower making you able to see things in data that with human eyes you wouldn’t be able to see.”
The Vesuvius Challenge is just one way the fast-moving field has shaken up science and revealed the unexpected in 2024. AI is also advancing scientists’ understanding of how animals communicate in the ocean depths, helping archaeologists find new sites in remote and inhospitable terrain, and solving some of biology’s greatest challenges.
Researchers know the enigmatic clicks made by sperm whales vary in tempo, rhythm and length, but what the animals are saying with these sounds — produced through spermaceti organs in their bulbous heads — remains a mystery to human ears.
Machine learning, however, has helped scientists analyze nearly 9,000 recorded click sequences, called codas, that represent the voices of approximately 60 sperm whales in the Caribbean Sea. The work may one day make it possible for humans to communicate with the marine animals.
The scientists examined the timing and frequency of codas in solitary whale utterances, in choruses, and in call-and-response exchanges between the marine giants. When visualized with artificial intelligence, previously unseen coda patterns emerged in what the researchers described as akin to phonetics in human communication.
In all, the program detected 18 types of rhythm (the sequence of intervals between clicks), five types of tempo (the duration of the entire coda), three types of rubato (variations in duration), and two types of ornamentation — an “extra click” added at the end of a coda in a group of shorter codas.
These features could all be mixed and matched to form an “enormous repertoire” of phrases, the scientists reported in May. However, the approach has its limitations. While machine learning is adept at identifying patterns, it doesn’t shed light on the meaning.
A next step, according to the study, is interactive experimentation with whales, along with observations of whale behavior, which could be an important part of unraveling the syntax of sperm whale click sequences.
The approach could also be applied to vocalizations by other animals, Dr.
Brenda McCowan, a professor at the University of California Davis School of Veterinary Medicine, previously told CNN. She was not involved in the study.
Meanwhile, on land, artificial intelligence is now turbocharging the search for mysterious lines and symbols etched into the dusty ground of Peru’s Nazca Desert that archaeologists have spent nearly a century uncovering and documenting.
Often only visible from above, the sprawling pictograms depict geometric designs, humanlike figures and even an orca wielding a knife.
A group of researchers led by Masato Sakai, a professor of archaeology at Japan’s Yamagata University, has trained an object detection AI model with high-resolution imagery of the 430 Nazca symbols mapped as of 2020. The team included researchers from IBM’s Thomas J. Watson Research Center in Yorktown Heights, New York.
Between September 2022 and February 2023, the team tested the accuracy of its model in the Nazca Desert, surveying the promising locations by foot and with the use of drones The researchers ultimately “ground truthed” 303 figurative geoglyphs, almost doubling the known number of geoglyphs in a matter of months.
The model was far from perfect. It suggested a staggering 47,000 potential sites from the desert region, which covers 629 square kilometers (243 square miles). A team of archaeologists screened and ranked those suggestions, identifying 1,309 candidate sites with “high potential.” For every 36 suggestions made by the AI model, the researchers identified “one promising candidate,” according to the study.
Nevertheless, AI has the potential to make huge contributions to archaeology, particularly in remote and harsh terrains such as deserts, even though the models are not yet entirely accurate, said Amina Jambajantsan, a researcher and data scientist at the Max Planck Institute of Geoanthropology’s department of archaeology in Jena, Germany.
Jambajantsan wasn’t involved in the Nazca research but uses an AI model to identify burial mounds in Mongolia based on satellite imagery.
“The problem is archaeologists don’t know how to build a machine learning model and data scientists, typically, are not really interested in archaeology because they can get much more money elsewhere,” Jambajantsan added.
AI models are also helping researchers understand life at the smallest scale: strings of molecules that form proteins, the building blocks of life.
While proteins are built from only around 20 amino acids, these can be combined in almost endless ways, folding themselves into highly complex patterns in three-dimensional space. The substances help form hair, skin and tissue cells; they read, copy and repair DNA; and they help carry oxygen in the blood.
For decades, decoding these 3D structures has been a challenging and time-consuming endeavor involving the use of fussy lab experiments and a technique known as X-ray crystallography.
However, in 2018 a game-changing AI-based tool arrived on the scene. The latest iteration of the AlphaFold Protein Structure Database, developed by Demis Hassabis and John Jumper at Google DeepMind in London, predicts the structure of almost all 200 million known proteins from amino acid sequences.
Trained on all the known amino acid sequences and experimentally determined protein structures, the database acts as a “Google search.” It provides access at the touch of a button to predicted models of proteins, accelerating progress in fundamental biology and other related fields, including medicine. The tool has been used by at least 2 million researchers around the world.
“It’s really a stand-alone breakthrough solving a traditional holy grail in physical chemistry,” Anna Wedell, a professor of medical genetics at Karolinska Institutet in Sweden and a member of the Royal Swedish Academy of Sciences, told CNN after Hassabis and Jumper were among the three winners of the 2024 Nobel Prize for chemistry.
The tool does have some limits. Attempts to apply AlphaFold to proteins based on mutated sequences, including one linked to early breast cancer, have confirmed that the software is not equipped to predict the consequences of new mutations in proteins.
AlphaFold is only the most high-profile of a number of AI tools being deployed in biomedical fields. Machine learning is accelerating efforts to compile an atlas of every single type of cell in the human body and discovering molecules that become new drugs, including a type of antibiotic that may work against a particularly menacing drug-resistant bacteria.
Mindy Weisberger and Taylor Nicioli contributed to this report"
2024-12-21,Apple AI feature under fire after false Luigi Mangione headline,The press freedom group Reporters Without Borders is urging Apple to remove its newly introduced artificial intelligence feature that summarizes news stories after it produced a false headline from the BBC about Luigi Mangione and previously ...,"The press freedom group Reporters Without Borders is urging Apple to remove its newly introduced artificial intelligence feature that summarizes news stories after it produced a false headline from the BBC about Luigi Mangione and previously erroneously summarized a New York Times story, claiming that Israeli Prime Minister Benjamin Netanyahu had been arrested."
2024-12-21,This robot taught a lesson in Germany. Hear what students thought,"Students at Willms High School in Germany experienced a day of lectures and debates led by Captcha, an AI-operated robot developed by robotics company Hidoba Research.","Students at Willms High School in Germany experienced a day of lectures and debates led by Captcha, an AI-operated robot developed by robotics company Hidoba Research."
2024-12-20,Apple urged to remove new AI feature after falsely summarizing news reports,The press freedom group Reporters Without Borders is urging Apple to remove its newly introduced artificial intelligence feature that summarizes news stories after it produced a false headline from the BBC.,"The press freedom group Reporters Without Borders is urging Apple to remove its newly introduced artificial intelligence feature that summarizes news stories after it produced a false headline from the BBC.
The backlash comes after a push notification created by Apple Intelligence and sent to users last week falsely summarized a BBC report that Luigi Mangione, the suspect behind the killing of the UnitedHealthcare chief executive, had shot himself.
The BBC reported it had contacted Apple about the feature “to raise this concern and fix the problem,” but it could not confirm if the iPhone maker had responded to its complaint.
On Wednesday, Reporters Without Borders technology and journalism desk chief Vincent Berthier called on Apple “to act responsibly by removing this feature.”
“A.I.s are probability machines, and facts can’t be decided by a roll of the dice,” Berthier said in a statement. “The automated production of false information attributed to a media outlet is a blow to the outlet’s credibility and a danger to the public’s right to reliable information on current affairs.”
More broadly, the journalist body said it is “very concerned about the risks posed to media outlets by new A.I. tools, noting that the incident emphasizes how A.I. remains “too immature to produce reliable information for the public, and should not be allowed on the market for such uses.”
“The probabilistic way in which A.I. systems operate automatically disqualifies them as a reliable technology for news media that can be used in solutions aimed at the general public,” RSF said in a statement.
In response to the concerns, the BBC said in a statement, “it is essential to us that our audiences can trust any information or journalism published in our name and that includes notifications.”
Apple did not respond to a request for comment.
Apple introduced its generative-AI tool in the US in June, touting the feature’s ability to summarize specific content “in the form of a digestible paragraph, bulleted key points, a table, or a list.” To streamline news media diets, Apple allows users across its iPhone, iPad, and Mac devices to group notifications, producing a list of news items in a single push alert.
Since the AI feature was launched to the public in late October, users have shared that it also erroneously summarized a New York Times story, claiming that Israeli Prime Minister Benjamin Netanyahu had been arrested. In reality, the International Criminal Court had published a warrant for Netanyahu’s arrest, but readers scrolling their home screens only saw two words: “Netanyahu arrested.”
The challenge with the Apple Intelligence incident stems from news outlets’ lack of agency. While some publishers have opted to use AI to assist in authoring articles, the decision is theirs. But Apple Intelligence’s summaries, which are opt-in by the user, still present the synopses under the publisher’s banner. In addition to circulating potentially dangerous misinformation, the errors also risk damaging outlets’ credibility.
Apple’s AI troubles are only the latest as news publishers struggle to navigate seismic changes wrought by the budding technology. Since ChatGPT’s launch just over two years ago, several tech giants have launched their own large-language models, many of which have been accused of training their chatbots using copyrighted content, including news reports. While some outlets, including The New York Times, have filed lawsuits over the technology’s alleged scaping of content, others — like Axel Springer, whose news brands include Politico, Business Insider, Bild and Welt — have inked licensing agreements with the developers."
2024-12-19,Humanoid robot that can do laundry and make coffee could be yours next year,Tech companies around the world are racing to be the first to bring humanoid robots to people’s homes.Enter NEO — a robot that can help around the house whether the user is there or not — available to the public in 2025. Kristie Lu Stout has the details.,"Tech companies around the world are racing to be the first to bring humanoid robots to people’s homes.
Enter NEO — a robot that can help around the house whether the user is there or not — available to the public in 2025. Kristie Lu Stout has the details."
2024-12-19,AI chatbots are becoming popular for therapy. Here’s what mental health experts say about them,"As AI technology advances, more people are using chatbot platforms in place of human interactions — including for therapy. Here’s what experts want you to know.","I turned to ChatGPT on my laptop to check out the artificial intelligence bot’s therapeutic abilities.
“Hi, I’m Therapist GPT — your friendly, empathetic companion here to provide a listening ear and support you with whatever’s on your mind,” the user-created ChatGPT bot wrote to me. (Last year, ChatGPT’s creator, OpenAI, rolled out the ability for users to build their own “GPTs” that function like its core ChatGPT product but are tailored for a specific purpose.)
“Whether you’re feeling overwhelmed, need some guidance, or just want to share your thoughts, I’m here to help. While I’m not a substitute for professional therapy, I can offer comforting advice, coping strategies, and a safe, judgment-free space to express yourself. How are you feeling today?” the message from the bot continued.
Therapist GPT is clearly not a real therapist, and the program does not advise users to substitute it for one. Still, many social media users are turning to chatbots — not just those found on ChatGPT — to confide in the technology.
Mya Dunham, 24, has turned to the ChatGPT phone app for the last two months when she needs advice. About twice a week, Dunham will write out her feelings and send them to the bot for analysis and feedback.
“My goal is to learn a new perspective, just to have a different viewpoint on it, because whatever I think in my head is going to be based off of my own feelings,” Dunham said.
Dunham used the chatbot for the first time in October after seeing someone else post about a positive experience on social media. “My opening phrase was, ‘Honestly, I just need someone to talk to, can I talk to you? And the bot was like, ‘Absolutely.’ And it was way more welcoming and inviting than I expected it to be,” she said.
“I didn’t expect it to feel so human.”
When Dunham posted about her experience on TikTok, commentors were split on the use of chatbots in this way. Some said they also look to it for therapeutic purposes, while others expressed doubt they would feel comfortable talking to a robot, she said.
This developing technology could be beneficial in certain situations, but there are also risks to keep in mind, mental health experts say. Here’s what they want you to know.
Dunham, who is from Atlanta, has tried therapy with humans a few times but said she prefers the chatbot for its lack of facial expressions. The bot doesn’t come off as judging her, she said.
“Some users, some populations, might be more apt to disclose or open up more when talking with an AI chatbot, as compared to with a human being, (and) there’s some research supporting their efficacy in helping some populations with mild anxiety and mild depression,” said Dr. Russell Fulmer, chair of the American Counseling Association’s Task Force on AI and a professor and director of graduate counseling programs at Husson University in Bangor, Maine.
“On the other hand, there’s some ethics concerns and things we need to be careful with,” he noted.
Fulmer recommends that people use chatbots in collaboration with human counseling. A therapist can help navigate a patient’s personal goals with using the bots and clarify any misconceptions from the chatbot session.
There has been some research on clinician-designed chatbots that can potentially help people become more educated on mental health, including mitigating anxiety, building healthy habits and reducing smoking.
But the risks that come with using general chatbots are that they may not have been designed with mental health in mind, said Dr. Marlynn Wei, a psychiatrist and founder of a holistic psychotherapy practice in New York City. The bots might not have “safety parameters and ways of identifying if the issue needs to be taken over to a clinician or a human professional.”
Chatbots could give out incorrect information or information that the user wants to hear instead of what a human therapist might recommend with mental health in mind, said Wei, who has a performance project that explores people’s reactions to AI clones of themselves and their loved ones.
“The (problems) are the ‘hallucinations’ and bias and inaccuracies,” Wei said. “I have a lot of hope for AI as a sort of in combination and augmentation of work, but on its own, I think there are still concerns around the bias that exists within AI, and then also the fact that it can make up things. … I think that’s where having a human therapist would be most useful.” AI services also have different safety guidelines and restrictions in terms of what the bots can discuss with users.
The chatbots might be more accessible for certain people, such as those who don’t have the money or insurance for therapy or who don’t have time in their schedules since some chatbots are free to use and can respond day or night, Fulmer said.
“In those cases, a chatbot would be preferable to nothing,” but people need to understand what a chatbot “can and can’t do,” he said, adding that a robot is not capable of certain human traits such as empathy.
Fulmer does not advise minors or other vulnerable populations to use the chatbots without guidance and oversight from parents, teachers, mentors or therapists.
Character.AI, an artificial intelligence chatbot company, is currently facing a lawsuit brought by two families who accused it of providing sexual content to their children and encouraging self-harm and violence. Separately, a Florida mother filed a lawsuit in October alleging that the platform was to blame for her 14-year-old son’s suicide, CNN previously reported. (Chelsea Harrison, head of communications at Character.AI, told CNN earlier that the company does not comment on pending litigation but that “our goal is to provide a space that is both engaging and safe for our community.” The company said it has made various safety updates, including ensuring bots will direct users to third-party resources if they mention self-harm or suicide.)
Dr. Daniel Kimmel, a psychiatrist and assistant professor of clinical psychiatry at Columbia University, experimented with ChatGPT therapy in May 2023, giving the chatbot a hypothetical patient and comparing the responses with what Kimmel would have offered the patient.
He told CNN that the chatbot “did an amazingly good job of sounding like a therapist and using many of the techniques … that a therapist would use around normalizing and validating a patient’s experience (and) making certain kinds of general but accurate recommendations.”
But what was missing was the inquisitiveness that a human psychotherapist might have with a patient, asking questions that dig a little deeper than what the patient initially says and that “connect the dots underneath the surface,” he added.
“As a therapist, I believe therapists are doing at least three things at once. We’re listening to what patients (are) saying in their words. You have to in order to be in the conversation,” Kimmel said. “Then, in the back of your mind, you are trying to connect what they’re saying to some bigger picture things that the patient said before (and) concepts and theories that you’re familiar with in your expertise, and then finally filtering the output of that through ideas about what’s going to be most helpful to the patient.”
At this point, chatbots could pose risks if they were to fail to fulfill those steps and instead provide guidance that the patient may not be ready to hear or may not be helpful in the situation, he said.
Furthermore, conversations with professional therapists are covered by the Health Insurance Portability and Accountability Act, known as HIPAA, and your health information is private and protected, Wei said. General chatbots are often not compliant with the federal law restricting the release of medical information, and the companies behind the bots will frequently advise users not to share sensitive information in their conversations with the bots, Wei added.
Ultimately, Kimmel said future research on AI chatbots would be beneficial in understanding their potential and applications for mental health. “This is not a technology that’s going away,” he said.
Dunham said she believes that the technology could be helpful to those like her who feel more introverted and want to talk out their feelings without another person present.
“We have to prioritize our mental health over everything,” Dunham said. “Even if it doesn’t look like a traditional way (of therapy), not to necessarily look down on it, because this can help so many people.”
For her, “the takeaway would just be not to judge the next person for how they heal.”"
